
{

    "select": {"gen": {"@type": "prov:WasGeneratedBy"},
	       "act": {"@type": "prov:Activity"},
	       "waw": {"@type": "prov:WasAssociatedWith"}},



    "query": [
	"prefix ex <http://example.org/#>",
	"select * from  gen a prov:WasGeneratedBy",
	"from act a prov:Activity",
	"join gen.activity = act.id",
	"from waw a prov:WasAssociatedWith",
	"join act.id = waw.activity",
	"where act[prov:type] >= 'ex:Baking' "],

    

    "sentence": {
	"type": "clause",
	"object":  {"type": "noun_phrase",
		    "head": {"@object": "gen",
			     "@field":  "entity",
			     "@function": "localname"},
		    "features": {"number": {"@object": "gen",
					    "@field": "entity",
					    "@function": "pluralp"}}},
	"verb": "bake",
	"modifiers": [{"type": "preposition_phrase",
		       "preposition": "by",
		       "noun": {"@object": "waw",
				"@field": "agent",
				"@optional": "true",				
				"@function": "localname"}},
		      {"type": "preposition_phrase",
		       "preposition": "at",
		       "noun": {"@object": "gen",
				"@field": "time",
				"@optional": "true",				
				"@function": "timestring"}}],	
	"features" : {"tense": "past",
		      "passive": "true"}

    },

    "context": {
	"ex": "http://example.org/#"
    }
    
    
}
